<?xml version="1.0" encoding="UTF-8"?>
<sbml xmlns:xsi="http://www.w3.org/1999/XMLSchema-instance" xsi:noNamespaceSchemaLocation="C:\Documents and Settings\afinney\My Documents\exchange-format\sbml.xsd" version="1">
	<model>
		<listOfCompartments>
			<compartment name="x"/>
		</listOfCompartments>
		<listOfSpecies>
			<specie name="y" compartment="x" initialAmount="1"/>
		</listOfSpecies>
		<listOfReactions>
			<reaction name="x">
				<listOfReactants>
					<specieReference specie="y"/>
				</listOfReactants>
				<listOfProducts>
					<specieReference specie="y"/>
				</listOfProducts>
			</reaction>
		</listOfReactions>
	</model>
</sbml>
