<?xml version="1.0" encoding="UTF-8"?>
<sbml xmlns:xsi="http://www.w3.org/1999/XMLSchema-instance" xsi:noNamespaceSchemaLocation="C:\Documents and Settings\afinney\My Documents\exchange-format\sbml.xsd" version="1">
	<model substanceScale="-3">
		<listOfCompartments>
			<compartment name="cell"/>
		</listOfCompartments>
		<listOfSpecies>
			<specie name="x0" compartment="cell" initialAmount="1"/>
			<specie name="x1" compartment="cell" initialAmount="1"/>
			<specie name="s1" compartment="cell" initialAmount="1"/>
			<specie name="s2" compartment="cell" initialAmount="1"/>
		</listOfSpecies>
		<listOfParameters>
			<parameter name="vm" value="2" scale="-3">
				<listOfUnits>
					<unit type="mole"/>
					<unit type="litre" power="-1"/>
					<unit type="second" power="-1"/>
				</listOfUnits>
			</parameter>
			<parameter name="km" value="2" scale="-3">
				<listOfUnits>
					<unit type="mole"/>
				</listOfUnits>
			</parameter>
		</listOfParameters>
		<listOfReactions>
			<reaction name="v1">
				<listOfReactants>
					<specieReference specie="x0"/>
				</listOfReactants>
				<listOfProducts>
					<specieReference specie="s1"/>
				</listOfProducts>
				<kineticLaw formula="(vm*s1)/(km+s1)"/>
			</reaction>
			<reaction name="v2">
				<listOfReactants>
					<specieReference  specie="s1"/>
				</listOfReactants>
				<listOfProducts>
					<specieReference  specie="s2"/>
				</listOfProducts>
				<kineticLaw formula="(vm*s2)/(km+s2)"/>
			</reaction>
			<reaction name="v3">
				<listOfReactants>
					<specieReference specie="s2"/>
				</listOfReactants>
				<listOfProducts>
					<specieReference specie="x1"/>
				</listOfProducts>
				<kineticLaw formula="(vm*s1)/(km+s1)"/>
			</reaction>
		</listOfReactions>
	</model>
</sbml>
